{
  "$schema": "./menu.schema.json",
  "version": 1,
  "miseAJour": "2026-09-03",
  "restaurant": {
    "nom": "KING FOOD",
    "sousTitre": "Vous êtes entre de bonnes mains",
    "adresse": "Cotonou — Fidjrossè · Akpakpa (Sine Concorde)",
    "telephone": "+229 01 96 96 96 93",
    "telephones": "Fidjrossè : +229 01 96 96 96 93 · +229 01 51 54 54 15 — Akpakpa : +229 01 59 88 99 88 · +229 01 40 95 95 19",
    "horaires": "Ouvert tous les jours à partir de 10h",
    "maps": "https://www.google.com/maps/search/?api=1&query=King+Food+Cotonou",
    "reseaux": "Facebook · Instagram · TikTok : KING FOOD COTONOU",
    "devise": "F",
    "mention": "Service livraison disponible. Prix en francs CFA."
  },
  "salles": [
    {
      "id": "la-carte",
      "label": "La carte",
      "categories": [
        {
          "id": "entree-froide",
          "label": "Entrée froide",
          "items": [
            {
              "numero": "1",
              "nom": "Salade verte simple",
              "description": "laitue, concombre, tomate, oignon, œuf dur",
              "prix": "3500"
            },
            {
              "numero": "2",
              "nom": "Fatouche",
              "description": "laitue, concombre, tomate, oignon, carotte, menthe, citron, huile d'olive, pain grillé",
              "prix": "4500"
            },
            {
              "numero": "3",
              "nom": "Salade Niçoise",
              "description": "laitue, tomate, pomme de terre, anchois, thon, petits pois, concombre, olive noire, œuf dur",
              "prix": "6000"
            },
            {
              "numero": "4",
              "nom": "Salade d'avocat aux crevettes",
              "description": "laitue, avocat, crevettes, oignon, tomate, persil",
              "prix": "6000"
            },
            {
              "numero": "5",
              "nom": "Salade Océane",
              "description": "laitue, carotte, tomate, cœur de palmier, amande grillée, thon, crevette, avocat, oignon",
              "prix": "6500"
            },
            {
              "numero": "6",
              "nom": "Salade King Food magnifique",
              "description": "laitue, tomate, avocat, poulet grillé, maïs doux, poivron, oignon, pomme de terre, œuf dur, boulette de viande",
              "prix": "7000"
            },
            {
              "numero": "7",
              "nom": "Suggestion du chef",
              "description": "laitue, concombre, tomate, saucisson, œuf dur, poulet grillé, carotte, olive noire, oignon",
              "prix": "6000"
            },
            {
              "numero": "8",
              "nom": "Salade Russe",
              "description": "laitue, pomme de terre, betteraves, petits pois, oignon, concombre, spaghettis, mayonnaise, œufs, thon",
              "prix": "6000"
            },
            {
              "numero": "9",
              "nom": "Salade Maison",
              "description": "laitue, maïs doux, carotte, betterave, pomme de terre, œuf dur, poulet, tomate, oignon, vinaigrette à l'ail",
              "prix": "5500"
            }
          ]
        },
        {
          "id": "entree-chaude",
          "label": "Entrée chaude",
          "items": [
            {
              "numero": "10",
              "nom": "Hors d'œuvre à chaud",
              "description": "carotte, pomme de terre, petits pois, boulette de viande, poivron, crème d'oignon, choux",
              "prix": "5500"
            },
            {
              "numero": "11",
              "nom": "Soupe de poisson",
              "prix": "4000"
            },
            {
              "numero": "12",
              "nom": "Assiette de frites",
              "description": "frites, salade de choux, moutarde, ketchup",
              "prix": "3500"
            },
            {
              "numero": "13",
              "nom": "Assiette d'aloco",
              "prix": "3000"
            },
            {
              "numero": "14",
              "nom": "Soupe de poulet aux vermicelles",
              "prix": "4000"
            },
            {
              "numero": "15",
              "nom": "Méli-mélo au foie de volaille",
              "description": "haricot vert, pomme de terre, foie de volaille, grenadine, oignon, céleri, poivron, coriandre fraîche",
              "prix": "5000"
            }
          ]
        },
        {
          "id": "sandwichs",
          "label": "Sandwichs",
          "items": [
            {
              "numero": "16",
              "nom": "Fahita",
              "description": "poulet, champignon, maïs doux, poivron, avocat, fromage, mayonnaise",
              "prix": "3500"
            },
            {
              "numero": "17",
              "nom": "Panini Parisien",
              "description": "avocat, poulet, maïs doux, laitue, tomate, fromage",
              "prix": "4000"
            },
            {
              "numero": "18",
              "nom": "Crispy Poulet",
              "description": "crispy, choux, crème d'ail, ketchup",
              "prix": "3500"
            },
            {
              "numero": "19",
              "nom": "Steak Sub",
              "description": "émincé de bœuf, oignon, champignon, poivron, mayonnaise",
              "prix": "3500"
            },
            {
              "numero": "20",
              "nom": "Chicken Sub",
              "description": "poulet, oignon, champignon, poivron, crème d'ail",
              "prix": "4000"
            },
            {
              "numero": "21",
              "nom": "Sandwich au thon",
              "prix": "2500"
            }
          ]
        },
        {
          "id": "chawarmas",
          "label": "Chawarmas",
          "items": [
            {
              "numero": "22",
              "nom": "Chawarma végétarien",
              "description": "légumes, champignons, sauce, frites",
              "prix": "2000"
            },
            {
              "numero": "23",
              "nom": "Chawarma frites",
              "description": "choux, crème d'ail, frites, ketchup",
              "prix": "2000"
            },
            {
              "numero": "24",
              "nom": "Chawarma kafta viande",
              "description": "kafta viande, légumes, frites, sauce",
              "prix": "2000"
            },
            {
              "numero": "25",
              "nom": "Chawarma kafta viande + fromage",
              "prix": "2500"
            },
            {
              "numero": "26",
              "nom": "Chawarma double kafta viande",
              "prix": "3500"
            },
            {
              "numero": "27",
              "nom": "Double kafta viande + fromage",
              "prix": "4000"
            },
            {
              "numero": "28",
              "nom": "Chawarma viande steak",
              "description": "viande steak, légumes, frites, sauce",
              "prix": "2500"
            },
            {
              "numero": "29",
              "nom": "Chawarma viande libanais",
              "description": "viande, persil, oignon, tomate, sauce tartare",
              "prix": "2500"
            },
            {
              "numero": "30",
              "nom": "Chawarma viande steak + fromage",
              "prix": "3000"
            },
            {
              "numero": "31",
              "nom": "Chawarma taouk poisson",
              "description": "taouk, frites, crème d'ail, cornichon",
              "prix": "3500"
            },
            {
              "numero": "32",
              "nom": "Chawarma taouk poulet",
              "description": "taouk, frites, choux, crème d'ail, cornichon",
              "prix": "3500"
            },
            {
              "numero": "33",
              "nom": "Chawarma poulet",
              "prix": "3000"
            },
            {
              "numero": "34",
              "nom": "Chawarma poulet + fromage",
              "description": "poulet grillé, crème d'ail, choux, oignon, tomate, frites, sauce",
              "prix": "3500"
            },
            {
              "numero": "35",
              "nom": "Chawarma kafta poulet",
              "description": "kafta poulet, crème d'ail, choux, oignon, tomate, frites, sauce",
              "prix": "2500"
            },
            {
              "numero": "36",
              "nom": "Chawarma double kafta poulet",
              "prix": "3500"
            },
            {
              "numero": "37",
              "nom": "Chawarma kafta poulet + fromage",
              "prix": "3000"
            },
            {
              "numero": "38",
              "nom": "Double kafta poulet + fromage",
              "prix": "4000"
            },
            {
              "numero": "39",
              "nom": "Chawarma suggestion du chef",
              "description": "poulet grillé, viande steak, frites, fromage",
              "prix": "5000"
            }
          ]
        },
        {
          "id": "burgers",
          "label": "Burgers",
          "note": "Prix : sandwich / assiette",
          "items": [
            {
              "numero": "40-41",
              "nom": "Burger végétarien",
              "prix": "2500 / 3500"
            },
            {
              "numero": "42-43",
              "nom": "Hamburger viande",
              "prix": "3500 / 4500"
            },
            {
              "numero": "44-45",
              "nom": "Chicken Burger",
              "prix": "4000 / 5000"
            },
            {
              "numero": "46-47",
              "nom": "Cheese Burger",
              "prix": "4000 / 5000"
            },
            {
              "numero": "48-49",
              "nom": "Cheese chicken Burger",
              "prix": "4500 / 4500"
            },
            {
              "numero": "50-51",
              "nom": "Double Burger",
              "prix": "4000 / 4500"